{
  "agreement": {
    "price": 500000000,
    "asset": "gpu-a100-1h",
    "asset_type": "compute",
    "delivery_requirements": {
      "method": "api",
      "deadline": 1735689600,
      "verification": "automatic",
      "details": "GPU compute access via API endpoint"
    },
    "payment_amount": 500000000,
    "payment_token": "SOL",
    "deadlines": {
      "delivery": 1735689600,
      "payment": 1735603200,
      "dispute_window": 1735776000,
      "expiration": 1736294400
    },
    "cancellation_policy": {
      "buyer_can_cancel": true,
      "seller_can_cancel": true,
      "cancellation_window_seconds": 3600,
      "refund_policy": "full",
      "penalty_basis_points": 0
    },
    "settlement_conditions": {
      "auto_release_on_delivery": true,
      "require_buyer_confirmation": true,
      "dispute_resolution": "mutual",
      "preimage_reveal_required": false
    },
    "buyer": "shaK3ufmCdHfjdqntZX1EJc56UXnDg4gqs8wLchumHD",
    "seller": "9vLzRq9NfP2GmJ7QwE8YxK4VcT3WbHsN1M6uP5jR2sAq",
    "marketplace_id": "finality-marketplace-v1",
    "negotiation_id": "neg-2024-08-05-001",
    "timestamp": 1722835200,
    "version": 1
  },
  "agreement_hash": "10c150844cb933e197743da39559d099c5fbf84a27f88d87622a644811f82b09",
  "human_approval": {
    "approved": true,
    "approver": "human-operator-1",
    "timestamp": 1722835260,
    "signature": "approval-sig-abc123"
  },
  "buyer_keypair": {
    "publicKey": "shaK3ufmCdHfjdqntZX1EJc56UXnDg4gqs8wLchumHD",
    "secretKey": [
      190,
      208,
      54,
      241,
      233,
      73,
      56,
      194,
      54,
      209,
      84,
      64,
      246,
      67,
      121,
      207,
      100,
      8,
      3,
      124,
      9,
      71,
      83,
      114,
      170,
      245,
      47,
      225,
      250,
      129,
      168,
      162,
      12,
      252,
      235,
      1,
      206,
      28,
      121,
      250,
      244,
      3,
      83,
      225,
      112,
      239,
      14,
      169,
      244,
      106,
      166,
      208,
      184,
      62,
      105,
      63,
      54,
      103,
      8,
      61,
      25,
      25,
      102,
      28
    ]
  },
  "cluster": "devnet"
}